{
  "namespace_id": "test",
  "parent_id": null,
  "tier": "custom",
  "version": 1,
  "entities": {
    "User": {
      "name": "User",
      "primary_key": "userId",
      "attributes": {
        "userId": {
          "name": null,
          "data_type": "string",
          "primary_key": false,
          "nullable": false,
          "default_value": null
        },
        "firstName": {
          "name": null,
          "data_type": "string",
          "primary_key": false,
          "nullable": false,
          "default_value": null
        },
        "lastName": {
          "name": null,
          "data_type": "string",
          "primary_key": false,
          "nullable": false,
          "default_value": null
        }
      },
      "relationships": {}
    }
  },
  "fsms": {}
}